{
  "plan_type": "strength",
  "plan_id": "albatros-south-mass",
  "schema": "2026-04-09T22:00:00Z",
  "plan_name": "Альбатрос Юг -- Масса 2x/нед",
  "plan_version": 8,
  "created_at": "2026-04-08T21:30:00Z",
  "author": "Claude",
  "notes": "v8: корректировка после 4-й тренировки (08.04). НАПОМИНАНИЕ: дроп-сет = вес ПАДАЕТ на 30%. Не держи тот же вес! Кардио 10-15 мин разминка. База = straight sets RIR 1-2. Унилатеральная работа на спину для асимметрии (правая слабая).",
  "templates": [
    {
      "id": "day-a",
      "name": "День A",
      "groups": [
        {
          "name": "Ноги",
          "exercises": [
            {
              "id": "a1", "name": "Жим ногами", "body_part": "legs", "equipment": "machine",
              "sets": [
                { "type": "warmup", "reps": 15, "weight_kg": 40 },
                { "type": "warmup", "reps": 12, "weight_kg": 65 },
                { "type": "working", "reps": 12, "rir": 2, "weight_kg": 90 },
                { "type": "working", "reps": 12, "rir": 1, "weight_kg": 90 },
                { "type": "working", "reps": 12, "rir": 1, "weight_kg": 90 }
              ],
              "rest_seconds": 150, "technique": "straight", "tempo": "2-2-1-0",
              "notes": "90кг. Пауза 2с внизу. Когда 3x12 -- +5кг.",
              "stretch_focus": true
            },
            {
              "id": "a2", "name": "Разгибание ног сидя", "body_part": "legs", "equipment": "machine",
              "sets": [
                { "type": "working", "reps": 12, "rir": 0, "weight_kg": 40 },
                { "type": "drop", "reps": 8, "weight_percent_drop": 0.3 },
                { "type": "working", "reps": 12, "rir": 0, "weight_kg": 40 },
                { "type": "drop", "reps": 8, "weight_percent_drop": 0.3 }
              ],
              "rest_seconds": 120, "technique": "drop_set",
              "notes": "Дроп = СРАЗУ сбрось 30% (40->28кг) и продолжай БЕЗ отдыха."
            },
            {
              "id": "a3", "name": "Сгибание ног лежа", "body_part": "legs", "equipment": "machine",
              "sets": [
                { "type": "working", "reps": 14, "rir": 1, "weight_kg": 18 }
              ],
              "rest_seconds": 90, "technique": "myo_reps", "max_mini_sets": 5,
              "notes": "Myo-reps. 18кг. Вес НЕ меняется."
            }
          ]
        },
        {
          "name": "Грудь",
          "exercises": [
            {
              "id": "a4", "name": "Жим от груди Matrix", "body_part": "chest", "equipment": "machine",
              "sets": [
                { "type": "warmup", "reps": 15, "weight_kg": 15 },
                { "type": "warmup", "reps": 12, "weight_kg": 25 },
                { "type": "working", "reps": 12, "rir": 2, "weight_kg": 35 },
                { "type": "working", "reps": 12, "rir": 1, "weight_kg": 35 },
                { "type": "working", "reps": 12, "rir": 1, "weight_kg": 35 }
              ],
              "rest_seconds": 150, "technique": "straight", "tempo": "2-1-1-0",
              "notes": "35кг. 3x10-12.",
              "stretch_focus": true
            },
            {
              "id": "a5", "name": "Fly на тренажере", "body_part": "chest", "equipment": "machine",
              "sets": [
                { "type": "working", "reps": 15, "rir": 1, "weight_kg": 30 },
                { "type": "working", "reps": 15, "rir": 1, "weight_kg": 30 }
              ],
              "rest_seconds": 90, "technique": "straight",
              "notes": "30кг, 12-15 повторов.",
              "stretch_focus": true
            }
          ]
        },
        {
          "name": "Спина",
          "exercises": [
            {
              "id": "a6", "name": "Тяга верхнего блока", "body_part": "back", "equipment": "cable",
              "sets": [
                { "type": "warmup", "reps": 15, "weight_kg": 10 },
                { "type": "working", "reps": 12, "rir": 2, "weight_kg": 23 },
                { "type": "working", "reps": 12, "rir": 1, "weight_kg": 23 },
                { "type": "working", "reps": 12, "rir": 1, "weight_kg": 23 }
              ],
              "rest_seconds": 120, "technique": "straight",
              "notes": "23кг. Когда 3x12 -- +2.5кг.",
              "stretch_focus": true
            },
            {
              "id": "a9", "name": "Тяга гантели одной рукой в наклоне", "body_part": "back", "equipment": "dumbbell",
              "sets": [
                { "type": "working", "reps": 12, "rir": 2, "weight_kg": 10 },
                { "type": "working", "reps": 12, "rir": 1, "weight_kg": 10 },
                { "type": "working", "reps": 12, "rir": 1, "weight_kg": 10 }
              ],
              "rest_seconds": 90, "technique": "straight",
              "notes": "Унилатеральная! Упор на скамью. ПРАВАЯ рука первая. Левой столько же повторов.",
              "stretch_focus": true
            }
          ]
        },
        {
          "name": "Руки (суперсет)",
          "exercises": [
            {
              "id": "a7", "name": "Бицепс наклонная скамья", "body_part": "arms", "equipment": "dumbbell",
              "sets": [
                { "type": "warmup", "reps": 15, "weight_kg": 3 },
                { "type": "working", "reps": 12, "rir": 1, "weight_kg": 6 },
                { "type": "working", "reps": 12, "rir": 1, "weight_kg": 6 },
                { "type": "working", "reps": 12, "rir": 1, "weight_kg": 6 }
              ],
              "rest_seconds": 90, "technique": "superset", "superset_with": "a8",
              "notes": "6кг.",
              "stretch_focus": true
            },
            {
              "id": "a8", "name": "Трицепс pushdown с канатом", "body_part": "arms", "equipment": "cable",
              "sets": [
                { "type": "warmup", "reps": 15, "weight_kg": 8 },
                { "type": "working", "reps": 12, "rir": 1, "weight_kg": 13 },
                { "type": "working", "reps": 12, "rir": 1, "weight_kg": 13 },
                { "type": "working", "reps": 12, "rir": 1, "weight_kg": 13 }
              ],
              "rest_seconds": 90, "technique": "superset", "superset_with": "a7",
              "notes": "13кг. Отдых 90с ПОСЛЕ пары."
            }
          ]
        }
      ]
    },
    {
      "id": "day-b",
      "name": "День B",
      "groups": [
        {
          "name": "Ноги",
          "exercises": [
            {
              "id": "b1", "name": "Жим ногами (узкая постановка)", "body_part": "legs", "equipment": "machine",
              "sets": [
                { "type": "warmup", "reps": 15, "weight_kg": 40 },
                { "type": "warmup", "reps": 12, "weight_kg": 65 },
                { "type": "working", "reps": 12, "rir": 2, "weight_kg": 93 },
                { "type": "working", "reps": 12, "rir": 1, "weight_kg": 93 },
                { "type": "working", "reps": 12, "rir": 1, "weight_kg": 93 }
              ],
              "rest_seconds": 150, "technique": "straight",
              "notes": "08.04: 93x10/10 стабильно. Оставляем 93. Целимся 3x12, потом +5кг."
            },
            {
              "id": "b2", "name": "Болгарские сплит-приседы", "body_part": "legs", "equipment": "bodyweight",
              "sets": [
                { "type": "working", "reps": 12, "rir": 2, "weight_kg": 0 },
                { "type": "working", "reps": 12, "rir": 1, "weight_kg": 0 },
                { "type": "working", "reps": 12, "rir": 1, "weight_kg": 0 }
              ],
              "rest_seconds": 90, "technique": "straight",
              "notes": "08.04: 12/10/10. Левая слабее правой. Когда обе стороны 3x12 -- добавь 4кг.",
              "stretch_focus": true
            },
            {
              "id": "b3", "name": "Сгибание ног сидя", "body_part": "legs", "equipment": "machine",
              "sets": [
                { "type": "working", "reps": 12, "rir": 0, "weight_kg": 45 },
                { "type": "drop", "reps": 8, "weight_percent_drop": 0.3 },
                { "type": "working", "reps": 12, "rir": 0, "weight_kg": 45 },
                { "type": "drop", "reps": 8, "weight_percent_drop": 0.3 }
              ],
              "rest_seconds": 90, "technique": "drop_set",
              "notes": "45кг рабочий. ДРОП = СРАЗУ сбрось до ~32кг! 08.04: второй дроп был на 45 -- неправильно!",
              "stretch_focus": true
            }
          ]
        },
        {
          "name": "Грудь + плечи",
          "exercises": [
            {
              "id": "b4", "name": "Жим груди наклонный Olimp", "body_part": "chest", "equipment": "plate_loaded",
              "sets": [
                { "type": "warmup", "reps": 15, "weight_kg": 10 },
                { "type": "warmup", "reps": 12, "weight_kg": 20 },
                { "type": "working", "reps": 10, "rir": 2, "weight_kg": 25 },
                { "type": "working", "reps": 10, "rir": 1, "weight_kg": 25 },
                { "type": "working", "reps": 10, "rir": 1, "weight_kg": 25 }
              ],
              "rest_seconds": 150, "technique": "straight", "tempo": "2-2-1-0",
              "notes": "25кг! 08.04: 30x9/7/7 -- опять падение. Снижай до 25. Разминка: 10 и 20кг (не 40!).",
              "stretch_focus": true
            },
            {
              "id": "b5", "name": "Жим на плечи сидя", "body_part": "shoulders", "equipment": "machine",
              "sets": [
                { "type": "warmup", "reps": 15, "weight_kg": 5 },
                { "type": "working", "reps": 14, "rir": 1, "weight_kg": 7 }
              ],
              "rest_seconds": 120, "technique": "myo_reps", "max_mini_sets": 5,
              "notes": "СНИЖЕН с 9 до 7кг. 08.04: 9кг = активация только 8 повторов (нужно 12-15). На 7кг целимся в 12-15 на активации."
            }
          ]
        },
        {
          "name": "Спина",
          "exercises": [
            {